Unnamed: 0,rating,review,date,userName,title,quarter,year
634,4,"마블 시리즈는 재미있게 잘 보고 있음
아쉬운점은 스파이더맨 시리즈가 없음  헐크도

신규 컨텐츠 업그레이드가 늦으며
네플릭스에 비해 정규방송 드라마 등
전체적으로 콘텐츠가 빈약함

장기 가입 유도할 수 있는 뭔가가 필요함.",2022-01-30 15:56:47,초록이1001,마블 굿,2022/1Q,2022
1866,1,갑자기 화면이 안나오는거죠??!! 작동이 안되요 ㅠ ㅜ,2022-01-30 16:15:47,달달한하나슈,,2022/1Q,2022
926,5,좋아용,2022-01-30 16:54:49,뚠지,좋아용,2022/1Q,2022
1366,1,앱 화면 미니 모드도 없고 너무 불편...,2022-01-30 17:36:03,Thecrazy Kim,,2022/1Q,2022
1351,1,글씨 크기 설정 할수있게좀...티비로 보는데 안보여요,2022-01-30 21:24:37,Cheolgu Kim,,2022/1Q,2022
669,1,tv로 연결해서 보면 자막이 작아져요 원래 보통 크기였는데 .. 앱에서 따로 변경해도 똑같아요,2022-01-30 22:21:09,zizi zizizi,,2022/1Q,2022
1594,1,앱에서 로딩 때문에 제대로 본적이 몇번 없네요,2022-01-30 22:24:04,Taewan Kim,,2022/1Q,2022
3152,5,Nice good 👍 Disney+,2022-01-30 22:58:52,Korea buy,,2022/1Q,2022
2971,1,ㄷ느스느느느ㅡ느ㅡ느,2022-01-30 23:41:40,정영준,,2022/1Q,2022
57,1,다른건 그나마! 괜찮다고 해도 크롬캐스트로 연동했을때 자막크기가 너무 작은데 조절이 안되는게 좀 문제인거같아요 ㅜㅠ 이정도가격이면 타사처럼 폰에서 자막크기 변경하면 크롬캐스트로 연결했을때도 자막크기 변동이 연동되도록 수정해주셨으면 좋겠네요.,2022-01-31 00:47:20,빈콩빛,,2022/1Q,2022
1069,1,또 앱 열면 남색 바탕 화면에 진입이 안됨. 아마도 삼성 업그레이드가 돼서 오류가 난 거 같기도 한데. 이거 또 기다려야 함?,2022-01-31 01:39:09,Peter Wu,,2022/1Q,2022
415,3,"재생속도 조절과 자막 개선이 시급함
부가적으로 노트북 연결시 소리가 너무 작아서 음질 개선이 필요함",2022-01-31 02:51:01,donjuan609,재생속도와 자막,2022/1Q,2022
39,4,"볼것도 짱많고 화질도 좋고 재밌고 정말 좋아요!! 가격도 다른 영화 앱..? 에 비해 저렴하고 좋아요 그런데 자막 크기 설정 기능이 없네요 ㅜㅜ 스트리밍 하는 기기에 따라 적당한 자막 크기가 따라오면 좋겠는데 그것두 안되고..ㅜㅜ 폰,컴퓨터,태블릿까진 괜찮은데 티비로 볼때 자막이 넘나 작네요..이 부분만 빨리 개선되면 좋을것 같습니다!",2022-01-31 04:42:20,어몽어쓰,자막 크기 설정,2022/1Q,2022
367,1,크롬통해서 티비로 보면 자막이 현저하게 작아지네요 아무리 아이폰 설정으로 자막크기를 조절해도 아이폰에서 보는 경우에만 적용되고 티비엔 똑같이 작게나와요 어플 자체에서 자막 설정하는 아이콘이 아이폰엔 안뜨는거같은데 개선부탁드려요,2022-01-31 11:05:55,별명없음 그만좀빠꾸했으면,자막 크기 제발;;,2022/1Q,2022
672,2,"자막뿐아니라 팝업모드, 화면밝기조절, 음량조절이 없어 너무 불편함..",2022-01-31 12:06:10,혼홉홋,,2022/1Q,2022
747,1,"1. 자막 싱크 안맞음,
번역 안하고 넘어가는 대사 많음, 
1초? 만에 넘어가는 자막있음 읽을 수가 없음

2. 글자크기 조절 안됌 
특히 크롬캐스트로 연동해서 볼 때는 쥐콩만큼 작아서 눈 아픔

3. 휴대폰으로 볼 때 밝기 조절 안됌
세상 어두워서 폰으로 들어가게 생김

컨텐츠만 믿고 엉망진창으로 론칭한듯",2022-01-31 12:10:35,wkdzm__,개선 안해줍니까,2022/1Q,2022
3189,5,좋아요,2022-01-31 12:11:42,달려거북아,,2022/1Q,2022
1803,1,다음화재생 버튼 좀 만드세요;;; 나온지 얼마나 지났는데 아직도 안만드냐,2022-01-31 12:46:30,김은호,,2022/1Q,2022
428,3,"스파이더맨도 마블아닌가요,, 스파이더맨 볼려고 앱 깔았는데 스파이더맨이 없네요ㅠㅠ 빨리 새로운 컨텐츠가 생겼으면 좋겠습니다",2022-01-31 13:16:09,선미20,스파이더맨,2022/1Q,2022
521,2,크롬캐스트로 미러링하여 사용중인데 자막이 너무 작게 나와요 어떻게 해결하나요ㅠㅠ,2022-01-31 13:17:54,rlawlgus190,크롬캐스트 사용시 자막이 너무 작아요,2022/1Q,2022
1864,1,저ㅠㅠ 환불부탁드려요 실수로 구독취소를 못했어요,2022-01-31 13:37:48,송강아지,,2022/1Q,2022
2398,5,개좋음...사랑해요 디즈니...♡♡♡,2022-01-31 14:12:37,유유,,2022/1Q,2022
1271,1,크롬캐스트 사용중인데 자막이 진짜 진짜 개미만해요 진심 자막보느라 영상이 안보임,2022-01-31 14:28:21,앙쥬,,2022/1Q,2022
3190,5,좋아요,2022-01-31 14:46:44,이동훈,,2022/1Q,2022
444,3,티브로 캐스트해서 보는데 자막이 작아졌더라구요 키울수도 없고  원래 안이랫는데여,2022-01-31 15:28:19,ararabora,캐스트중 자막크기,2022/1Q,2022
2402,5,와... 박박 좋다...,2022-01-31 17:02:13,다희송송,,2022/1Q,2022
335,5,어릴때 봤던 알라딘 이나 인어공주 티비 시리즈가 그리워요,2022-01-31 18:49:22,멋진우아기,디즈니 애니메이션 티비판이 더 많았음 좋겠어요,2022/1Q,2022
628,1,컨텐츠가 너무 부족합니다. 디즈니 채널이면 모든 디즈니 컨텐츠를 다 보게끔 해줘야 되는데 그것도 아니고 일부만 있어서 정기결재 하고 해지했습니다. 노력이 필요할것 같아요.,2022-01-31 20:36:15,Erica J,,2022/1Q,2022
2317,4,다양한 스토리 필요,2022-01-31 20:47:58,살포시,,2022/1Q,2022
3219,5,👍,2022-01-31 20:56:59,d b,,2022/1Q,2022
541,1,심슨32 E.2 보다가 중간부터 검은화면에 음성만 나오더니 모든 영상이 검은화면에 소리만 나오네요. 디플 라디오였나요? 요즘 라디오도 보.라.인데ㅡㅡ+ 라디오앱보다 못하다니,2022-01-31 23:48:36,로얄윌크티,,2022/1Q,2022
2762,1,15세라 해놓고 18세라고 하는거 짜증나네,2022-01-31 23:51:32,뭉이,,2022/1Q,2022
1355,5,랙도 잘안걸리고 컨탠츠가 많아서 좋아요 한달에9900원 이라서 갓성비도 좋아요,2022-01-31 23:55:27,은서의VLO G,,2022/1Q,2022
2380,1,설강화만 없으면 좋겠다,2022-02-01 00:24:29,김선화,,2022/1Q,2022
363,1,디즈니만 실행하면 와이파이 연결이 끊어질때가 있음 앱 실행하다 와이파이가 끊어지는건 첨 겪음 페이지 로딩도 엄청 느리고 다운로드도 엄청 불안정함 끊어졌다 재실행도 안되고 삭제도 안됨 그냥 실행하면 먹통 ㅜㅜ,2022-02-01 00:32:04,손형석,,2022/1Q,2022
1867,5,많이들 보세요. 저는 안 보지만 다들 재미있대요ㅋㅋ,2022-02-01 01:05:52,Yeonu Joo,,2022/1Q,2022
678,1,"모바일 폰에서만 되고, 
노트북에서는 왜 서비스가 안되나요?
OTT 전쟁인데.. 넷플릭스는 다 되는데..",2022-02-01 07:07:01,ieva_laguna,노트북에서는 왜 서비스가 안되나요?,2022/1Q,2022
778,1,크롬캐스트 연결해서 보면 자막이 너무 작아요. 자막 설정하는 메뉴도 없고.,2022-02-01 10:38:07,추가정보,,2022/1Q,2022
2371,1,"볼게 없다,,, 너무 없다 ㅡㅅㅡ 돈 아꿉",2022-02-01 11:54:29,Kyung-Soo Shin,,2022/1Q,2022
584,1,일본에 서비스할때는 더빙하고 한국은 그냥 자막 한국 그냥 무시하고 보던가 말던가?공정하게 전체 작품 더빙만이 디즈니플러스가 한국서 살길이다. 그나만 컨텐츠도 없는거 더빙판이라도 올려야지 아니면 볼게 너무 너무 없네,2022-02-01 12:29:00,런던아이,,2022/1Q,2022
1334,5,너무 좋아요 다만 모바일 버전에 팝업기능이 있었으면 좋겠어요,2022-02-01 12:30:21,유리자베스,,2022/1Q,2022
3180,1,느림,2022-02-01 12:42:33,엄용식,,2022/1Q,2022
3396,5,시ㅡ,2022-02-01 14:00:46,신현섭,,2022/1Q,2022
177,4,다 좋은데 시청 기록 못 보는 거랑 프로필 사진에 닥스 없는게 화가 남. 후자만이라도 해주면 별 5개로 고치러 오겠음..,2022-02-01 15:43:08,하딩딩💙멜로디,이게 말이 되나,2022/1Q,2022
56,2,우선 자막...한 작품을 한 사람에게 안맡기고 여러명이서 나눠서 했는지 퀄리티가 중구난방 그 자체. 등장인물끼리 반말을 하다가 어느 편이 되면 서로 존대를 하다가 더 보다보면 또 반말을 하는데 호칭이나 말투가 다 달라져있고...아무튼 개판. 이런게 한 두 작품이 아님. 앱 자체도 반응속도가 상당히 느린 편. 1년 구독한거 진심 후회됨.,2022-02-01 15:49:24,popori,,2022/1Q,2022
637,1,어플이 아예 실행이안되네요..빨리좀고쳐주셨으면 좋겠어요. 갤럭시 s20 유저입니다(최신버전으로 업데이트한상태),2022-02-01 16:15:29,Seon Gyeong Jeong,,2022/1Q,2022
2738,4,마블 좋아하시는 분들은 강추!,2022-02-01 16:19:25,김종필,,2022/1Q,2022
2374,3,중간에 왜 튕겨 도대체,2022-02-01 17:26:20,김동천,,2022/1Q,2022
1174,1,자막이 거지같아서 더빙으로 듣고 컨텐츠가 한국은 늦게 출시하네요 보바펫 언제나오나 궁금하네요,2022-02-01 17:34:22,rain gentel,,2022/1Q,2022
2365,4,배속 시스템이 잇었으면 좋겠어요.,2022-02-01 18:35:49,김경림,,2022/1Q,2022
3218,5,👍,2022-02-01 18:41:36,junghyun kim,,2022/1Q,2022
1840,1,배속 없으면 쓸 필요 없지. 마블 영화만 영화인 것도 아니고. 유튜브 무비로 볼렵니다.,2022-02-01 21:08:03,Hazard-19 H-19,,2022/1Q,2022
1347,1,자막수준 낮음 다음 화 재생 시 전체화면이 해제됨,2022-02-01 21:09:23,Myoung Kyu Jeon,,2022/1Q,2022
2277,1,IP 없으면 망할 서비스,2022-02-01 21:18:36,서강민,,2022/1Q,2022
3173,5,좋다,2022-02-01 22:23:23,Naomi Nam,,2022/1Q,2022
2400,5,넘 재밌어요~강다니엘 연기에 푹 빠졌습니다~👍👍👍💓💓💓,2022-02-01 23:42:03,루시다,,2022/1Q,2022
535,2,엔칸토보는데 한국어자막이 아니고 중국어 자막이 나오네요 자막을 한국어로 설정해봐도 중국어나오는데 좀 고쳐주세요;;,2022-02-02 04:02:39,보초저유,자막 상태 뭡니까,2022/1Q,2022
990,1,스붕이들 진짜 적당히 무시해야지 연간권 끊은게 가장 큰 실수다,2022-02-02 05:48:50,ㅓ머캬더터ㅑ넠ㅋ,자막 개판,2022/1Q,2022
1884,2,번역이 쓰레기예요,2022-02-02 06:53:38,토끼,,2022/1Q,2022
3421,5,굳,2022-02-02 10:15:46,THANOS Mr.,,2022/1Q,2022
1919,5,좋은 영화 모여있어 좋네요,2022-02-02 10:39:02,이강용,,2022/1Q,2022
2227,1,구글 추가 백업 결제가 안됨. 거부됨.,2022-02-02 11:02:12,강이,,2022/1Q,2022
453,1,북오브 보바펫 해외 딪플에서 이미 한국어 자막과 더빙이 다 있음. 근데 한국에서는 해외보다 1달늦은 2월2일에 나옴. 이러면 지금까지 나온 에피소드를 다 공개해야 하는게 정상인데 그것도 아닌 2일 당일은 3개만 공개한 후 1주일에 1편씩 공개. 역시 혐즈니 플러스가 어떻게든 돈 뜯으려고 하는 발악으로 보인다. 그리고 2일 공개면 1달 기다렸으니 0시에 공개를 해야지 아직도 안나오고 있음. 여러분들은 혐즈니 플러스 말고 넷플보세요,2022-02-02 11:45:22,퍼시,,2022/1Q,2022
2411,2,안녕자두야 제주도편도 추가해주세요 ㅠㅠㅠ 그러면 별점 부계까지 5점 드리고 홍보 많이 해드릴께요 ㅠ,2022-02-02 14:25:53,귤탱,,2022/1Q,2022
256,4,"좋긴 한데 디즈니,어벤져스 외에는 딱히 볼게 없고…
그리고 자막 크기 설정 어떻게 해요? 자막 크기가 너무 커서 집중이 잘 안돼요….",2022-02-02 14:28:43,예귤이,자막,2022/1Q,2022
386,2,자막 정말 보기 힘드네요.. 주인공들의 관계도 제대로 이해하지 못하고 무조건 다 존대로 번역해놔서 집중하기 힘들어요!! 적어도 인물관계도는 이해하고 번역해주길.. 그레이아나토미 시즌 16 진짜ㅠ 그리고 속도 조절도 되었으면 합니다!!,2022-02-02 14:28:58,임경옥 Lisa,,2022/1Q,2022
987,5,"최고의 작품이다. 단 한 순간도 눈을 뗄수가 없었다. 
진실은 반드시 거짓을 이긴다는 것. 거짓이 승리하면 노력한 정의의 피와 땀이 물거품 된다는 것을 생각하게 하는 작품이다.
부패한 거대의 권력에(현재의 사법부 같은 추악한 권력)맞서 싸우는 진실은 반드시 통한다는 것을 여실히 보여준 작품이다.",2022-02-02 14:36:19,mjc-justis,역시 리들리스캇의 작품! 그리고 멧디이먼 !,2022/1Q,2022
455,3,1. 몇몇 자막의 띄어쓰기가 길게(ex.동해물과___백두산이___마르고___닳도록) 나와서 스무스하게 보기가 힘들다. (내셔널지오그래픽) 2. 내셔널지오그래픽 영상이 적다. 유튜브에 클립으로 올라온 것들이라도 업데이트 됐으면 좋겠다.,2022-02-02 15:57:52,리본즈퀀터ENZA,,2022/1Q,2022
469,5,이런저런 문제 있으신분들 한번 쯤 확인 하세요. 컨텐츠가 부족하다? TV로 가입하신 분들은 앱이나 웹에서 프로필수정 들어가서 콘텐츠 시청등급 18+인지 확인 해주세요. 디즈니는 영화컨텐츠가 엄청납니다. 타서비스 유료 영화들 다 무료에요. 넷플릭스처럼 첫화면에 잘 안보인다고 콘텐츠 없다고 하시는 분들은 음~ 새이름 폴더에 무엇이 있는지 모르는 부모님과 같습니다. 자막이 이상하다? 브라우저에서 혹은 기기에서 자동번역 기능을 사용하는지 확인해 주세요. 폰에서 크롬캐스트사용시 자막크기가 작다? 안드로이드면 설정 접근성 청각 자막환경설정에서 글꼴크기키우기 아이폰은 손쉬운 설정으로 가서 찾아보세요. 결제는 웹에서 디즈니+홈페이지에서 하는게 좋습니다. 인앱결제는 구글이나 애플 정책따릅니다. 구독취소와 환불을 혼동하지 마세요. 디즈니+는 웹연동으로 진행되는 부분이 많아서 브라우저도 최신이거나 캐시삭제 쿠키삭제 해주어야할 필요가 있습니다. This is the way!~,2022-02-02 16:06:18,Pot Honey,,2022/1Q,2022
2774,5,위승현 고은강 케미 설레요,2022-02-02 18:40:40,MS S,,2022/1Q,2022
1095,5,진짜 너무 재미있게 보고있고 세로운마블영화를 보니더 재미있었어요,2022-02-02 20:05:18,떡군TV,,2022/1Q,2022
2760,5,가슴이 시원합니다.^^,2022-02-02 21:56:30,전정인,,2022/1Q,2022
1581,5,컨텐츠도 많고 재미있는게 많았어요,2022-02-02 22:11:14,권우진,,2022/1Q,2022
3151,1,The warning signs doesn't go off. How am I supposed to watch a movie🖕,2022-02-03 00:41:16,LunAtic XD,,2022/1Q,2022
2666,1,배속설정좀업뎃해주시라요,2022-02-03 01:09:24,아수라,,2022/1Q,2022
3385,5,아주 째ㅓㅓㅓㅓ앙!,2022-02-03 01:11:47,김태형,,2022/1Q,2022
2383,1,내 폰 A52 기준 가장 불안정한 어플,2022-02-03 06:21:48,P순우,,2022/1Q,2022
397,1,디즈니가 서버가 이렇게 안 좋아도 되는 건가? 싶을 정도로 서버가 너무너무 안 좋음 들어가면 로딩 오분 넘게 걸린 것 다수 내 노트북이 느린건가 싶어서 넷어쩌구랑 라어쩌구도 켜봤는데 바로 되서 어이없음 짝퉁디즈니인가 싶은,2022-02-03 06:34:09,별명을 생성하시요,넷어쩌구랑 기싸움한다고 들었는데 넷어쩌구 코딱지만큼도 안 됨,2022/1Q,2022
2373,5,이건 돈내고 보라해도 꼭 봐야해,2022-02-03 11:01:26,윤따TV,,2022/1Q,2022
674,1,검색하면서 드라마 보려고 했는데 안 됨. 재생속도 조절 안 됨..앱 기능이 초보적임.,2022-02-03 13:07:27,ko조용한 회원,,2022/1Q,2022
307,4,폰에서도 작기도 한데 크롬케스트로 볼때 너무 작아요.. 부탁드립니다,2022-02-03 13:43:56,tastyloper,자막좀 키워주세요,2022/1Q,2022
394,4,돈내고보는건데 중간에 버퍼링걸리는건 해결해줬으면 좋겠네요. 콘텐츠는 완벽합니다! +)자막안맞는분들은 이렇게보세요. 이게맞습니다. 오디오:영어 - 자막:한국어,2022-02-03 13:51:10,sunset37,,2022/1Q,2022
554,5,제가 본것중에 진짜 최고인데용???????!,2022-02-03 13:55:07,춤춰요 돔곰,❤️❤️❤️❤️❤️,2022/1Q,2022
1122,1,얼마 전부터 계속 검은 화면만 뜨고 접속이 안 되네요ㅡㅡ,2022-02-03 15:38:09,엘리스,,2022/1Q,2022
869,3,로딩이 너무 길어 답답해요,2022-02-03 15:40:53,귀요미~^^*****,로딩이 길엉요,2022/1Q,2022
1887,5,안드로이드 12 업데이트 이후 안됨,2022-02-03 16:46:05,SG M,,2022/1Q,2022
2706,1,배속기능내놔라,2022-02-03 17:02:14,뿅뛟,,2022/1Q,2022
1373,3,smart tv와 연동성이 없음. 팝업재생,2022-02-03 18:49:27,권문철,,2022/1Q,2022
614,1,잼있는것좀 많이 올려주세요. 돈 아깝습니다.요금을 내리던가요~,2022-02-03 19:20:50,nonoremove,생각보다 양이 없어요,2022/1Q,2022
1354,2,"넷플처럼 회차정보, 앞뒤 장면 검색등이 잘 되었으면",2022-02-03 20:04:57,Yuni Kim,,2022/1Q,2022
774,4,1. 자막 음성 기본 설정 기능 2. 장면 바로가기 매번 설정 바꾸기 귀찮고 보고싶은 부분 가려면 종일 걸리고 불편해요,2022-02-03 22:27:55,in-hyeok choi,,2022/1Q,2022
775,1,크롬캐스트 연결해서 보면 자막 엄청 작아져요.. 넷플 왓챠 티빙 다 문제 없는데 디플만 그런 현상이 있네요,2022-02-03 22:33:07,Ho Lo,,2022/1Q,2022
2403,5,너와나의 경찰수업 볼려고 깔았는데 은근 괜찮은듯,2022-02-03 23:23:07,김유은,,2022/1Q,2022
1364,4,다 좋은데 볼 컨텐츠가 조금더 풍부했으면 좋겠어요.,2022-02-04 00:22:28,Dennis lee,,2022/1Q,2022
864,1,"동영상 시청중
밝기조절 불가
소리조절 불가
다음화 넘어가기 불가
재생속도 조잘 불가

제일기본적인 기능조차 없음…",2022-02-04 00:46:25,테스트는해본거냐?,사용자 편리성이라고는 찾아볼수없는앱….,2022/1Q,2022
3194,5,굿,2022-02-04 01:15:36,민진,,2022/1Q,2022
236,2,"자막이 엉망이에요…. 막귀가 들어도 틀리게 번역된 부분도 많고, 반말했다가 존댓말했다가 제멋대로 입니다. 제일 거슬리는건 문어체 말투…어플리케이션의 기능적인 부분은 피드백 반영하면 나아질 여지가 있으나 번역 문제로 컨텐츠 질까지 떨어지는 느낌입니다.",2022-02-04 02:13:41,웬만하면리뷰안써요,자막이 엉망입니다,2022/1Q,2022
2394,4,따뜻한 애니메이션^^,2022-02-04 03:00:54,손잡기,,2022/1Q,2022
1839,1,오류코드39? 뭐에요... 결제했지만 보질 못하는 ㅜㅜ,2022-02-04 06:26:38,churp 01,,2022/1Q,2022
3428,5,좋아요,2022-02-04 11:53:23,와우쿠키 스타일,,2022/1Q,2022
2379,2,시청목록에서 안보는거 삭제 못하네요?,2022-02-04 13:12:28,J WON C,,2022/1Q,2022
3212,5,좋아여,2022-02-04 14:38:58,홍정수,,2022/1Q,2022
808,1,"편의사항이라고는 1도 찾아볼수가없다
다음화 넘기기
오프닝 점프로 제대로 안되고
빠른재생/음량/화면밝기
자동 자막 설정
모든게 다 불편해 죽겟다",2022-02-04 14:51:02,헤헤헤헤ㅋㅋㅋ,제발 어플 개선좀 해라,2022/1Q,2022
3455,5,야칸,2022-02-04 15:42:55,아이삐찌,,2022/1Q,2022
606,1,티비로볼때 렉이너무걸려요 ㅡㅡ 자막 늦게뜨는것도 그렇고 빨리 개선해주세요 ;;하,2022-02-04 16:17:06,맥날병신,렉걸림,2022/1Q,2022
3156,5,굿!!!!!,2022-02-04 16:33:32,쌤쌤의 놀이교실,,2022/1Q,2022
1736,1,왜 자꾸 결제가 되지않는거죠? 모든 방식을 다썼는데도 안되네요 구글 비번쳐도 틀렸다고나오고 비번찾기로 비번도 바꿨는데도 아니라고 뜨고,2022-02-04 17:05:31,정종웅,,2022/1Q,2022
1406,5,이 디즈니게임은 좋른거같고 제작자님은 너무나 잘만드셨어요!!!그리고. 안좋은점은 렉이랑. 버퍼링이 걸리기도하긴하데요.그래가주고 평가는 4개 주겠습니다 디즈니 작품을 잘 만드셨어요,2022-02-04 18:05:35,최정일,,2022/1Q,2022
2913,1,이거 돈네는건가요?,2022-02-04 19:14:27,김용현,,2022/1Q,2022
2470,1,남들 다보는 시간에 렉 미친듯이 뜸,2022-02-04 22:11:23,미로로,,2022/1Q,2022
1379,1,비번 바꾸려고하는데 다안된다고하네 ...어쩌라는겨,2022-02-04 22:36:43,주황색,,2022/1Q,2022
1468,5,다양한 메이크영상이랑 포함해서 매우 짱이예용,2022-02-04 23:28:48,이지현,,2022/1Q,2022
2416,5,정말로 최고입니다.^^♡,2022-02-05 00:10:10,조정문,,2022/1Q,2022
300,5,"**개인적으로 애니메이션을 좋아한다면 디즈니 플러스 쓰는것을 적극적극적극 추천함(티빙,넷플,왓챠 써봄)

2달써보고 느낀 단점 

- 저장해둔 콘텐츠를 오프라인 상태에서 보지않아도 자동으로 오프라인 상태에서 보는것처럼 화질이 좀 떨어짐    (은근히 거슬려서 짜증남) 그래서 저장해둔 콘텐츠를 삭제하고 봐야지 화질 정상으로 돌아옴 

-배속이 티비로 볼땐 가능하지만 핸드폰이나 아이패드로 볼땐 그렇게 되지않음 

장점

-어릴때부터 보고 자라온 애니메이션부터 최신 애니메이션까지 볼수 있다는거 

-첨에 봤을때 맘에드는 콘텐츠가 별로 없어서 
엥..1달만 보고 말아야지 했는데 내가 못찾은거 였음 

아쉬운점은 성인용 애니메이션이 좀 들어왔으면 함
ex) 릭앤모티…",2022-02-05 01:11:05,냙옭이,디즈니 광팬의 2달후기,2022/1Q,2022
123,3,"비행기에서 보려고 잔뜩 다운받아놨는데
인터넷 연결이 안되면 프로필 로그인조차 안되는군요ㅋㅋ
넷플릭스나 왓챠 등 다른 ott이 비해서 뭔가 너무 허술하단 느낌이 드네요",2022-02-05 02:23:01,맥부우기,오프라인 다운로드를 오프라인에서 사용할 수 없는 앱,2022/1Q,2022
441,1,자동재생이 됐다 안됐다해요.. 설정에서 자동재생 체크도하고 핀번호도 설정했는데.. 디즈니플러스 문의해도 원인을 모른다네요.. 시리즈볼 때 진짜 불편해요.,2022-02-05 03:31:44,이정민,,2022/1Q,2022
2958,5,마블뽕이 차오른다,2022-02-05 05:18:33,모구마,,2022/1Q,2022
988,3,"다음화 재생,볼륨 업더운,오프닝건너뛰등 불편함 다른곳에 비해 느림",2022-02-05 06:16:39,에볼렛,자동,2022/1Q,2022
2370,1,가입했고 앱 설치하려고 하는데 왜 설치가 안됩니까,2022-02-05 06:57:15,Eunice Lee,,2022/1Q,2022
3202,5,갓즈니,2022-02-05 10:47:09,Elsanna,,2022/1Q,2022
426,1,"Ui로 자막, 오디오 설정 불편함. 화질설정도 없음. 심지어 서비스 다른 나라보다 늦게 들어오면서 자막 이상하게 해놓음. 고객과 소통할 생각없음. Pc충이면서 진짜 논란될만한 것들에는 입 꾹 닫음.",2022-02-05 11:09:01,김예림,,2022/1Q,2022
312,4,비밀번호를 입력했는데 계속 안된다고 뜨면서 오류나요...살려주세요,2022-02-05 11:21:18,도yeon,로그인오류,2022/1Q,2022
1378,5,제가 제일재미있게 보았던거는 지금 우리 학교는...입니다 추천 드립니다 그래서별점5점 드립니다,2022-02-05 11:30:21,김미숙,,2022/1Q,2022
3453,5,구드,2022-02-05 12:39:17,따야따야,,2022/1Q,2022
784,1,"핸드폰으루 전체화면 만 재생가는 한것, 화면 잠금 안되는 것이 개선되면 좋겠습니다",2022-02-05 13:05:53,김수현,,2022/1Q,2022
255,2,"재생 속도를 바꿀 수가 없어 답답하고,
한 회 가 끝나면 자동으로 그 다음으로 안 넘어가는 게 불편해요
그 외엔 다른 ott와 비슷하고,
런닝맨 같은 다른 곳에서 못 보는 걸 볼 수 있어 재밌긴 하네요",2022-02-05 14:05:11,중독자웅동,속도 연속 재생,2022/1Q,2022
1259,2,팝업.배속 .자막.문제해결해야 많은분들이 가입하고 방영하는것들도 대박날듯싶네요,2022-02-05 14:15:55,깽3김,,2022/1Q,2022
38,1,안드로이드 삼성기기로 크롬캐스트로 전송하여 사용중입니다 자막크기가 극도로 작아졌어요 Pc에서 크롬캐스트로 전송해도 마찬가지로 자막이 너무작아 읽기 힘들어요 2. 재생중 해당 컨텐츠의 다음화나 다음시즌으로 이동 할 수 있었으면해요 다른화 보려면 아에 재생을종요시키고 다시 컨텐츠를 찾아 해당화를찾아야해요 3.다음화를 틀기위해 10초씩이동해서 다음화로 넘어가면 다음화재생시 재생바가 안사라지고 무한 로딩이되는 오류가 계속 발생중이에요 4. 최근 보고 종료한 시즌 화수가 제대로 저장이안되어서 재생할때마다 최근재생위치 화수를 찾아 재생해야합니다,2022-02-05 15:12:39,망순TV,,2022/1Q,2022
2758,1,아니 왜 어플이 안들어가짐?,2022-02-05 15:47:39,YoungWoo Kim,,2022/1Q,2022
266,2,"컨텐츠는 둘째치고 
앱사용자들의 편의성을 전혀 생각 안하는 듯합니다 
자막크기 연속재생 등등 빨리 업데이트 해주세요",2022-02-05 16:26:06,나나언니,써본 구독앱중 기능 최악이에요,2022/1Q,2022
2923,3,왜실행안되죠?,2022-02-05 18:04:44,박현주,,2022/1Q,2022
786,1,"pip, 자막 설정변경(왜 기기자체 환경설정을 바꿔야하는지?), 화질, 배속 등 기본적인거 하나도 안넣어놓고 돈만쳐먹는 ott 기본적인건 좀 갖추고 나오세요",2022-02-05 22:34:58,쉴드,,2022/1Q,2022
34,2,배속 없습니다. 밀어서 진행 바 이동 기능 없습니다. 소형 화면으로 보는 기능도 없습니다. 일단 영상 보고 싶은게 있으면 각 잡고 처음부터 끝까지 보고 재미없거나 지루한 부분을 넘기려면 더블 터치로 10초씩 이동해야 합니다. 요즘 이렇게 불편한 앱도 오랜만인거 같습니다. 웨이브도 얘보다는 기능이 많을겁니다.,2022-02-05 22:50:04,Welcome Hello,,2022/1Q,2022
