,userName,title,isEdited,review,date,rating
1216,마크 줫망겜,자막 좀 고쳐주세요,False,한국어 자막 효과음도 자막 넣는거 너무 불편하네요 이것만 좀 없었으면 좋겠습니다,2021-10-27 12:56:20,5
1217,옫뎌우러댜너,초세는것좀 그만해요..,False,다 좋은데요 영화하나 끝나면 자동으로 그다음 영화로 넘어가는거 진짜 짜증나구요 미리보기도 다보고 자동으로 영화 재생되는것도 짜증나요.왜그렇게 성격이 급한거에요??,2021-07-09 05:12:04,4
1218,ㅜㅠㅜㅠㅠㅜ,애니메이션 추가,False,"시간을 달리는 소녀
주술회전
나루토
하이큐 4기
제발 재미없는 애니 그만 넣고 얘네 좀 넣어주세요",2021-05-21 00:36:39,5
1219,전도로,업데이트후 매일 오류 발생입니다 ..,False,"업데이트 후 사용이 안됩니다. 어플 들어가면 로그아웃 되어있어서 로그인부터 해야하고, 로그인하면 프로필을 선택하는 중 오류가 발생했으니 나중에 다시 시도하라고 하고, 어플 새로 시작해서 프로필 선택까지 하고나면 동영상을 바로 시청할 수 없으니 다른 동영상을 시청하라고 뜨네요. 다른 동영상 눌러도 다 똑같은 메시지 뜹니다. 이 상태로 어플 껐다가 다시 켜면 다시 로그아웃 되어있고 처음부터 다시 반복이에요. 벌써 며칠짼지.. 빨리 수정해주세요",2021-06-02 15:06:56,1
1220,이만희소새끼,전에보다 별로에요,False,성인인증 하는게 한회차씩 볼려고 할때마다 뜨네요.... 전엔 안그랬었는데 왜그런건가요...?̆̎ 계정같은거도 홈페이지에서 볼수있게 바뀌고 좀 불편해진거 같아요,2020-03-03 17:25:10,3
1221,일본 애니 보는 1인,오류 좀,False,"다 좋은데요 오늘 보다가 에러 뜨면서 꺼지고, 중간에 자막 안나오다가 영상에서 소리도 안들려요. 어떨 때는 소리가 나오는데 자막은 이미 나온 자막으로 멈춰 있어요. 오류 좀 고쳐주세요.",2021-05-03 13:47:55,4
1222,lpjgvan,프로필에 face id 지원해주세요,False,"프로필 잠금기능은 좋은데 페이스아이디만 지원 됐으면 좋겠어요 
Please support face ID on profile.",2020-12-07 17:41:21,5
1223,꼴롤롤롤,왜 없죠?????,False,"식극의 소마 두번째 접시, 세번째 접시까지 있는데 왜 뒤에 더 없는건가요?? 뒤에 분명 더 있는데 그거 얼른 올려주세요 ㅠㅠㅠㅠ 정말 다 좋아요 근데 끝까지 다 볼수있게 해주세요 부탁드립니다ㅠㅠㅠㅠ",2020-08-23 20:27:21,4
1224,;;;;;ㅎ,드라마 추가 좀ㅠㅠㅠ,False,드라마 보고 싶은 건 검색하면 없어서 보질 못해요ㅠㅠㅠㅠㅠ 제발 지창욱 나오는 힐러랑 박서준 나오는 쌈마이웨이 추가해주세요... 더케이투는 있는데 웨 어떤 이유로 힐러가 없나요... 쌈마이웨이는 또 왜 없는 거고... 제발 추가해주세요... 이 두 개 보려고 웨이브나 티빙 결제하는 건 말이 안 되잖아요...,2020-07-22 07:23:19,4
1225,별명을 뭘로하라는거야야아다ㅏ아,"아이칼리, 빅토리어스 한국 넷플도 해주세요",False,ㅠㅜㅜ 외국에서는 빅토리어스 해주면서 왜 한국에는..ㅜㅜ 진짜 보고싶어요 그 명작을.. 사람들도 좋아할텐데...,2020-07-18 14:47:16,5
1226,kdon01,자막 크기가 안 바뀝니다,False,iOS 13.3 업데이트 이후 자막크기가 시청에 지장이 생길 정도로 커졌는데 기존의 방법대로 자막설정을 바꿔도 크기만 적용이 안되네요. 불편해서 도저희 이용 못하겠습니다 빠른 정상화 부탁드립니다,2019-12-19 08:15:51,3
1227,막창먹곡싶당,아이패드 호환,False,아이패드 에어 1세대는 호환되지 않는다고 하면서 다운이 안받아지네요 ㅠㅠ 그렇다고 사이트에서 볼 수 있는 것도 아니고 ..나온지 오래된 기기지만 호환되게 해주시면 안될까요 ㅠ,2020-02-29 05:05:16,4
1228,아라쓩,구독 취소 했는데 결제 된 것 같아요,False,"스토어에서 미리 구독 취소를 한 뒤에 이용했고, 1월 23일 이후에 확인차 몇 번 영상 눌러 봤을 때 이용이 가능하길래 그때는 날짜를 잘못 안 건 줄 알았는데요. 그 뒤로도 몇 번 들어갔는데 끝까지 재생하진 않았고, 재생만 가능한지 확인 했었는데 이상함을 못 느꼈었습니다. 그런데 오늘 다시 들어가보니까 여전히 영상 들어가져서 혹시 몰라서 홈페이지에 들어가 봤더니 다음 결제일이 2월 23일이더라고요...? 환불이 가능한지 여쭈고 싶습니다.",2020-02-01 15:13:39,1
1229,나나ㅈㄷ,ios 업데이트후 자막이 엄청커졌네요,False,업데이트하고 보니 자막이 화면의 3분의1이나 차지해서 보기 불편합니다. 설정에서 자막스타일바꿔도 글씨크기는 그대로네요. 빨리 고쳐주세요.,2019-12-13 13:40:03,3
1230,뽀뽀91,궁금사항이있습니다,False,저는 넥플릭스 결제를 해서 보고 있는 아이폰 유저에요! 며칠 전부터 업데이트가 되는 것 같더니 아예 실행이 안되서 지우고 다시 깔려고 했더니 앱이 아예 다운이 안됩니다. 어떻게해야하나요?,2019-09-18 11:52:29,3
1231,아방가루둥둥,불편하게 업데이트함,False,뭐 볼것고 많고 아주좋은데 매번 업데이트만하면 기존에 편한기능을 없애고 불편하게 만드는거같아서 좀 짜증나네요,2019-11-11 21:11:11,5
1232,와우!!감사합니다!!,넷플릭스 너무 좋아요!,False,"몇년째쓰고있는 넷플릭스 너무 좋아요!
딱하나 화면 고정?홀드? 기능있었으면 좋겠어요
조금만 화면 건드리면 멈춰서 이동하면서 보기
힘들어요..ㅠㅠ",2019-09-23 13:36:29,5
1233,솔삼삼,제발 더블캡 앞으로 재생기능점,False,진짜 다른어플에비해 깔끔하고 다양한 콘텐츠 좋아요 but!!!!콘텐츠만 좋으면 모해요 .. ux가 구려요..뒤로 가기 대신에 차라리 앞으로10초 해주시던가 유튜브처럼 더블탭으로 하시던가요... 처음으로 리뷰 남깆니다 넷플릭스의 발전을 위해!!,2018-09-04 14:35:00,3
1234,Becozy,다운로드가 잘 안됩니다.,False,"이전에는 괜찮았는데, 요즘따라 다운로드를 눌러도 대기만 뜰 뿐 다운로드 진행이 되지 않습니다. 한번에 다운로드 가능한 용량이 정해져 있는건지 아님 속도가 느려진건지, 개선 부탁 드립니다 ㅎㅎ",2019-05-11 07:40:36,4
1235,오멬ㅋ,버그 심각,False,"갑자기 드라마 다음 회차가 자동으로 다운로드 됨
짜증",2019-03-07 09:16:30,1
1236,ㅁㄴㅇㄹㄹ허ㅏ마마,한 회 영상이 끝까지 없고 잘린 상태에서 올라온게 있네요,False,브레이킹 배드 시즌 2부터 매 화가 다 47분씩인데 중간에 끊긴 상태로 끝나요ㅠㅠㅠㅜㅠㅜ 끝까지 올려주세요 제발,2019-02-01 14:35:35,4
1237,솜솜이불,개선했으면 하는 점,False,"이번 업데이트로 많이 편해졌지만
아이폰 X에서 영상을 시청하다 시간을 확인하기가 불편해요ㅜㅜ 개선할 수 없을 까요?
영상 시청 중 화면 터치 시 시간도 노출되면 좋을 것 같아요",2018-11-21 22:59:58,4
1238,왜안써져 몇번째쓰냐,구간이동은 대체 왜 안생기는거죠,False,구간이동 안되서 불편해죽겠어요. 뒤로 10초만있고 앞으로 가는건 없고 핸드모션도 안되고 설정도 따로 못하고 나아지는게 없네요. 그리고 장르구분해놨던건 검색창 들어가야 볼수있는지 이것도 불편하고 세부적으로 구분도 안되어있고 내가 원하는 영화는 검색하기 쉽지만 생각없지만 추천받아서 보기엔 좋지않앙ㅅ.,2018-07-01 16:22:12,2
1239,ㅛㅑㅕㅐ,"진짜 실망이네요 완전 소비자 기만,,",False,"어떻게 계정 이메일 주소를 다른 이메일 주소로 변경해서 계정을 만들었는데 이중청구가 되죠?? 정말 평소에 잘 쓰고 있었는데 카드 내역보고 깜짝 놀라네요 사전에 이중청구 안내도 없이 이렇게 해버리면 어떡합니까? 소비자 기만하는 겁니까? 5달동안 요금 두배로 내면서 쓰고 있었네요,, 진짜 너무 실망스럽습니다.",2021-10-06 07:45:22,1
1240,감다ㅗ쿵,에러 좀 고쳐주세요,False,진짜 다 좋은데 에러 뜨는 것 좀 어떻게 해주세요 다른 사람들 리뷰 보니까 에러 뜨는 게 한두 번도 아니고 계속 이어지는데 고쳐질 생각을 안 하네요 에러 제발 그만;,2021-08-03 17:40:50,3
1241,거지의사,재생이 되다 말다 하네요,False,아이폰 11pro 사용 중입니다. 데이터 사용 중인데도 밖에서 컨텐츠 시청시 로딩화면에서 멈추거나 시청 중에 컨텐츠를 재생할 수 없습니다라는 오류가 나타납니다. Ios버젼과 넷플릭스 버젼도 최신 버젼입니다,2020-06-23 22:13:14,3
1242,round egg,업데이트 이후 화면상 버그 의심,False,"업데이트 이후로 넷플릭스를 시청하다가 잠시 화면을 꺼놓고 있었습니다.
(2분가량) 그리고 다시 화면을 켜보니 0.1초가량으로 짧게 화면이 푸른색으로 번쩍거림이 생겼다가 본래 색상으로 돌아오는데요.
애플센터에 진단 받아보니 기기 이상은 아니라고 진단받았습니다
앱 버그가 의심되어 문의드립니다.",2021-06-23 06:46:44,2
1243,우흐히힇,기능개선 요구,False,"자막을 두개 켤수 있도록 해주시면
 미드보면서 영어공부하는데 도움이 될거같습니다
영어자막+한글자막",2021-05-01 11:45:04,5
1244,환불해주세여 어서,넷플릭스를 너무 잘 보고 있습니다,False,넷플릭스 폰으로도 영어와 한국어 자막을 같이 보고 싶습니다 업데이트 제발 부탁드립니다!!,2020-12-29 17:13:22,5
1245,ㅂㅁㄴㅈㄴㅇㅈ,차단 해제 프로그램 오류,False,"아이패드로 넷플릭스 이용 중에 갑작스레 차단 해제 프로그램 또는 프록시를 이용중이라며 에러가 떴습니다 이전까지 단 한번도 난 적 없던 오류이고 vpn, 프록시를 전혀 사용하지 않는데 왜 이런 문제가 발생하는지 원인 파악과 그 해결책 좀 마련해주시길 바랍니다",2018-12-27 17:39:16,3
1246,chgvytrrtyutty,다좋아요,False,그런데 시청중인 컨텐츠를 지울수 있게 해주셧음 합니다 보다가 취향이 안맞아 안보는걸 지울수 있게 해주세요 부탁드립니다,2020-03-19 18:33:50,5
1247,아이언맨사랑햐요,보고싶은 영화가 없어졌어요,False,제가 마블 시리즈 보려고 유료 결제 까지했어요 분명 아까전까지만해도 어벤져스 시빌워 등 있어서 보던거 마저 보고 봐야겟다 싶엇은데 지금 없어요 계속 확인해봤는데 없어요 .. 혹시 확인해주실수잇으실까요?,2020-03-15 12:16:44,4
1248,Jack the Taker,아니 미친 자막크기 언제 수정해주는거야?,False,"자막 크기 이 치명적인 결함을 몇 달 째 수정 안 하는건 뭔데? 업데이트 내용은 제대로 설명도 안 해주고 편리해 졌습니다 뙇! 어쩌라고 뭐가 편리한데 자막이 화면 가려서 안 보이는데. 아예 자막을 더 키우지? 화면 안 보고 자막만 보게 하라고, 소리 들으면서 읽는 드라마 이거 신박하네. 화면만 안 보이는 영화 이게 최신 트렌드냐 미친것들아. 돈 받아처먹었으면 이 정도 일은 해도 되는거 아님? 그거 자막 크기 수정하는데 돈 얼마나 잡아먹는다고 그걸 몇 달 째 안 하고 있어. 돈을 많이 잡아먹어서 오래 걸리면 그렇다고 공지라도 하든가 미친놈들이 아무 말도 없어 단 한마디도. 자막 문제는 왜 피드백이 하나도 없는데으아가아갸ㅡ야아나냐으아으냐다르라드잦 얀,ㅏㅁㄹ:₩8’#-)#’#₩",2020-02-12 18:03:15,1
1249,민늉,드라마 추가해주세요ㅠㅠㅠ,False,"""김비서가 왜이럴까""랑 ""연애의 발견""
너무 한국 드라마 너무 없어요... 정말 해지하려다가 
기다리는 중인데 언제쯤 저런게 나올까요...",2019-12-15 08:16:47,4
1250,wjd5061,너무 좋아요,False,"너무 잘보고 잇어요
근데 더 많은 영화나 야니메이션이 잇으면 좋겟어요
저는 디즈니 애니메이션 좋아하는데
인어공주랑 아나스타샤랑 더 해주세요!!!!",2019-08-01 06:34:58,5
1251,얘들아흥하자,아니진짜 제발 좀,False,아이폰도 시청기록관리하기 쉽게좀 만들어주라 안드로이드는 어플에서 뚝딱 해결되는데 아이폰은 홈페이지 들어가서 로그인 하래서 할라그랬더니 무슨 홈페이지에만 들어가면 자동으로 넷플릭스 어플이랑 연동되서 어플 열리고 뭐 난리 부르스에 어찌저찌 번거롭게 해서 들어가면 비밀번호 다르데서 재설정하려고 이메일 쳤더니 메일은 발송됐다 하면서 안오고 그짓거리 5번 반복하다 빡쳐서 안함. 안보고말지 안되어있는게 너무 많은거 아닙니까? 돈은 돈대로 거둬가면서 서비스 부족한게 너무 많은듯 싶네요 매 우 불 만 족~,2019-07-02 14:44:51,1
1252,마라탕에미쳐부러,잘쓰고 있지만 정말 아쉬운 단하나,False,"아이패드로 영상시청할때 세로로도 볼 수 있도록 해주셨으면 좋겠습니다.
영상을 틀면 무조건 가로로만 영상이 틀어지는데 많이 불편해요",2019-06-04 15:10:01,4
1253,melona453,멀티자막됐으면좋겠어요,False,넷플릭스를 즐겨보는데 자막이 한가지언어만 되니까 아쉬워요 ㅠㅠ 두가지언어 동시에 보고싶은데ㅠ크롬으로 할수있다는데 모바일어플로도 되면 좋겠어요!!,2019-06-03 16:09:26,4
1254,솜언니,배속설정 기능이 있었으면 좋겠어요,False,"드라마나 영화를 볼때 배속 설정이 있으면 좋을 것 같아요
스토리만 볼때는 조금 빠르게 보는 걸 좋아하는데
그럴 수 없어서 조금 슬프네요ㅜㅠ",2019-03-16 04:43:17,4
1255,Jiro pure,화질 왜 떨어지는거임,False,아이폰12프로에  5g 무제한 요금제 쓰는데  도대체 왜 화질이 거의 그냥 볼수없게 480p정도로 재생되는건가요 ㅡ.ㅡ 설정가서 고화질로 바꿔도 바뀌지 않네요,2021-11-28 06:28:48,3
1256,악튜멭쿨갉,에러관련,False,"아이폰 사용자입니다.
차단해제프로그램이나 프록시를 비활성화시켜달라고 하는데 어떻게 뭘 비활성화해야하는지 몰라 이용에 불편함을 겪고 있습니다",2018-10-31 04:44:27,4
1257,나는야포크,재밌는 것들도 많고 좋아요,False,"한달 무료구독만 할 생각이었는데 구독취소를 안해서 예상치 못한 지출이 생겼네요 흑흑
이번달 낸 돈 아까워서라도 열심히 보려구요...
돈 아까운거만 빼면 괜찮아요.. 재밌는거 많아요",2018-10-13 17:23:57,4
1258,배짜나,아이패드 split veiw,False,아이패드 split veiw랑 자막설정할수 있게좀 해주세요 옆동네 디즈니는 둘다 되는 기능인데,2021-11-30 06:32:20,5
1259,ggsjene,업데이트 이후에 아이패드 키보드 화살표가 안먹혀요,False,정말 잘 쓰고있는 어플중 하나인데 업데이트 이후 키보드로 앞으로 감기 뒤로 감기가 안먹혀요 얼른 수정업데이트 부탁드려요 항상 감사히쓰고있어요,2021-10-14 14:29:45,4
1260,보보보옹,콘텐츠 전체보기 추가해주세요,False,콘텐츠 뜰 때 옆으로 넘겨서 보는  방법밖에 없나요? 전체로 보고 싶은데 옆으로 보기밖에 없어서 불편해요ㅜㅜ 한국드라마장르를 고르면 추천으로 뜨는 게 아니라 작품 전체를 볼 수 있게 해주시면 좋겠습니다,2020-12-28 03:36:20,3
1261,앙샤윤,자막,False,자막을 키게 되면 그냥 대사만 나오는게 아니고 (ㅇㅇ이 아파하는 신음소리)이런거 나오는데 이거 없앨수 있게 설정기능 추가해주시면 안될까요??,2021-09-22 14:16:23,4
1262,킴호,발열이 너무 심해요,False,너무 잘 사용중인데요 예전엔 안그랬는데 몇 주간 한 편 채 다 보기도 전에 핸드폰이 너무 뜨거워져서 핸드폰을 들고있기도 힘들정도로 발열이 너무 심해요 핸드폰 터질까봐 걱정될 정도...예요,2021-08-21 05:07:20,4
1263,너무 좋은거 같아여,영화,False,좀 더 다양하게 해리포터 시리즈 이런것도 넣어주시몬 진짜 좋을거 같아요 ..제목에만 써있고 나오지는 않아서요 ..,2021-07-22 16:27:04,4
1264,인생7회차,감사해요,False,아 진짜 요즘에 애니 많이 데려오셔서 고맙습니다 사랑헤요근데 제발 주술회전도 추가해주세요ㅠ~~~~~~~~~!!!🙏,2021-03-12 10:09:14,5
1265,유저 우앙,출력되는 화면비좀 여러가지로 나눠주면 좋겠다,False,노치만큼만 잘라서 표시해주는거 왜안해줌 대체 16:10정도 되는영상 확대하면 위아래 조금씩 잘리고 노치가 가리고 있는거 불편해 죽어요 제발,2020-02-23 01:14:16,3
1266,아인양,넷플릭스 가입할 이거 꼭 보셈,False,"단점
1.다양한 드라마나 영화가 없음
2.아이패트 삼성패드로 보면 자막이 너무 큼
3.한국과 다른나라가 볼 수 있는게 다 다름 이런거 지역 바꾸면 괜찮다는데 지역 바꾸는데 다른사이트로 돈 들음
이런거 너무 심해서 나도 왓차로 갈아탈까 고민중임",2020-12-06 15:38:17,2
1267,1647384,제발..ㅠ,False,"정말 다 좋아요 근데 부탁인데요 제발 페어리테일 11기 까지 다 나오게 해주세요ㅠㅠㅠ 너무 재밌어요ㅜㅠㅠㅠㅠ 부탁이에요 ㅠㅠㅠㅠㅠ

It's all good. Please, please. Please, please, let me out of my hairyage 11th. Please make it's all fun.",2020-10-03 12:56:59,5
1268,배시영,자막오류 수정 부탁바람,False,자막이 나왔다가 안나오고 나왔다가 안나와서 집중력 뿐 만 아니라 분위기를 확 깨버려서 화가 나네요 돈 내고 이용하는건데 이런 불편사항이 빠른 시일내로 고쳐졌으면 좋겠습니다 저 뿐만 아니라 주위에 많은 이용자가 이러한 불편을 겪고 있습니다 영상화질을 우선적으로 하려다 보니 자막이 늦게 송출되는 것 같은데 빠르게 문제점 수정해주셨으면 합니다.,2020-09-21 05:56:10,1
1269,abo2330,정말 좋아요,False,앱 잘쓰고 있습니다 !! 다만 내가 찜한 콘텐츠에 폴더같은 것을 만들 수 있게 되서 정리할 수 있게 된다면 더 좋을 것 같아요,2020-07-24 14:08:23,5
1270,iiiiiinsta,배속제발요ㅠㅠ,False,"넷플릭스 정말 잘 사용하고 있는 유저입니다!
다 좋은데 배속기능 추가 부탁드립니다ㅠㅠ
유튜브처럼 배속기능이 있으면 좋을것 같아요 ! 감사합니다",2020-06-02 15:07:13,4
1271,kjw0330,한국 드라마,False,"인기도 순으로 배치해 주시면 감사하겠습니다. 제가 보았을 때 어떤 기준으로 선정을 하는 것 인지는 모르겠으나, 오히려 시청률이 높은 드라마 부터 구매하여 올려 주시면 감사하겠습니다. 찾는 드라마 대부분 없구요, 그렇다고 해서 시청률 순으로 갖고 오는 것도 아닌 듯 합니다. 하지만 그 외 화질이나 자막은 좋습니다.그리고 의학드라마도 추가해 주시면 좋겠어요...아무리 찾아도 한국 의학드라마는 없네요....추가해 주시면 감사하겠습니다",2020-02-26 12:53:06,2
1272,휴픂,캡쳐와 화질,False,재밌게 잘 보고 있긴 한데 캡쳐를 풀어주셨으면 좋겠네요 소비자가 캡쳐를 해서 뭘 한다고 막으셨는 지 이해가 안 되네요ㅠ 그리고 화질을 조정할 수 있었으면 좋겠어요 어느 부분은 화질이 별로이다가 어느 순간 갑자기 좋아지고 너무 왔다갔다가 심해서 조정할 수 있는 걸 만들어주셨으면 좋겠어요,2019-02-17 11:40:44,3
1273,djdjdifhshsj,다 괜찮은데,False,"배속으로 보기 기능도 있었으면 좋겠어요~
제가 성질이 급해서 드라마는 2배속으로 봐야되는데 넷플은 배속기능이 없네요ㅠㅠ",2020-01-28 19:17:58,5
1274,choiyoungseok,좋은데 영상들이 더 추가되었으면..,False,"세계적으로 
인기가 많고 대중적인 영화들이 더 추가되었으면 좋겠습니다 또한 보고싶은 영화를 건의 할 수 있는 기능이 있었으면 좋겠습니다 그렇게해서 건의수가 많은 영화들이 우선적으로 나왔으면 합니다",2020-01-16 05:42:15,4
1275,아라려쳐노두옽,배속 기능이 있었으면 좋겠어요.,False,"유튜브처럼 배속기능이 있었으면 좋겠습니다.
저처럼 한 화 한 화를 제 속도로 다 보기 힘든 사람들을 위해서 1.2배속이라도 있었으면 좋겠네요ㅠ",2019-11-07 16:39:22,5
1276,걸ㄹㅔ,정말 좋은데,False,영한 자막 동시에 볼 수 있었으면 너무 너무 좋겠어요 진짜 ㅠㅠㅠㅠㅠ 그리고 자막 크기나 그런 것도 설정할 수 있으면 좋겠구... 꼭 꼭 추가해주세요 동시 자막 ㅠ ㅠ ❤️❤️,2019-06-08 14:49:59,5
1277,; : - ),"한글, 영어 동시 자막이 있었으면 좋겠어요",False,두개를 같이 놓고 보면 영어지문에 비교를 할 수 있을 것 같아서 영어 공부에 도움이 된다고 생각합니다 아쉽게도 자막이 하나 밖에 나오지 않아 영어 공부에는 크게 도움이 되지 않네요!,2019-02-25 04:10:21,4
1278,산강바다,다음화가 안나와요.,False,"제가  컴퓨터로 넷플릭스 를 이용하는데요.
‘일단 뜨겁게 청소하라’ 라는 드라마를 보고있어요.
근데 10화 다음으로 11화가 떠야되는데 안 뜨더라고요. 그래서 한 화는 뛰 어 넘기로하고 12화가 나오 는 날짜에 들어가서 볼 라고하니까 12화도 안나오더라고요.
오류가 있는거라면 빨리 고쳐주셨으면 합니다.",2019-01-09 05:17:51,3
1279,그냥만든,다 좋습니다 딱 한가지 빼고요,False,"10초 넘기는 버튼 제발좀 만들어주세요 제발제발제발
영상들의 다양성도 좋고 보고싶은거 웬만한거 다 있는거도 좋은데 10초 뒤로 가기만 있고 왜 10초 앞으로 가는건 없나요 너무 불편해요",2018-11-03 18:21:12,4
1280,-_-ㅜ,앞으로 화면 넘기기 좀 만들어주세요,False,"너무 불편 영상 볼껀 많은데 넘기기 기능이 너무 한정적이네요. 6월 리뷰보면 생겼다는데 왜 없어진거죠?? 
그리고 고전 미드 많이 업뎃 부탁드려요 ㅠ 꼭 찾는건 없음 ㅠ",2018-08-30 21:07:55,3
1281,현썽ㅇ,오류가 넘 많아요ㅠㅠ,False,"1.보고 다음화로 넘겨서 오프닝 건너뛰기 하면 안될때가 있어요 다시 나갔다 들어오면 되더라고요
2.계속 보고있는 컨텐츠들이 없어져요 
고쳐주세여ㅠ",2021-12-16 09:16:33,3
1282,슈퍼셀 제발 쫌,제발 개선해주세요.,False,"제가 레이디버그를 영어로 보는데 어떤 시즌은 영어 음성이 있고 어떤 시즌은 없더라고요, 그래서 모든 시즌 다 영어 음성이 있었으면 좋겠어요. 게다가 레이디버그 시즌이 더 있는 걸로 아는데, 넷플릭스에는 다 없어서 아쉬워요. 레이디버그 모든 시즌 영어 음성, 레이디버그 시즌 추가! 이 두 가지 제발 개선해주세요!!!",2022-03-09 10:06:08,4
1283,주엲잉,배속기능 지원했으면좋겠어요,False,"제목그대로입니다! 1,2,3화를 훑어보고 대충 무슨 느낌인지 알고 정주행하고싶은데 배속있으면 작품 선택시에 큰 도움이 될거같습니다.",2020-03-08 04:35:32,3
1284,김민제l,이럴 거면 화질 설정이 왜 있는지,False,"일부러 돈 더 내고 화질 좋은 영상으로 보려고 스탠다드 결제 하고 있는데요. 
네트워크 연결이 안 좋은 것도 아니고 설정도 했는데 480p 싸이월드 시절 동영상 화질 뭔가요? 하루 이틀도 아니고. 특히 새로 업데이트되는 영상들이 유난히 더 심해요.",2021-10-16 16:13:14,2
1285,진격거 2기 돌려주세요,진격거 2기 좀 돌려주세요ㅠㅠ,False,진짜 2기 오프닝부터 레전든데 2기가 없오졌다니요ㅠㅠㅠㅠㅠ 재계약이라도 해서 2기 좀 돌려주세요ㅠㅠㅠ 진격거가 제 첫 애니이자 최애 애니인데 진격거 2기가 없어졌다는게 말이 안 돼요ㅠㅠㅠ 빠른 시간 내에 진격거 2기 돌려주세요ㅠㅠ,2021-10-13 11:25:36,5
1286,어디사람이할겜이없어서세나를해,왓챠로 가자,False,해외기업이라 그런지 결제방식부터 어플까지 편의성이 너무 구리고 개선할 생각이 없는듯. 사실상 개선이라기보다 그냥 기본이 안되어있음. 넷플 오리지널에 관심 없으면 그냥 왓챠가 백만배 나음. 살다살다 번호연동 인증번호 안오는건 처음이네. 무슨 어플이 아직도 회원가입도 안되고.. 진짜 그냥 구려터진 구시대유물같은 앱,2021-09-05 16:14:15,1
1287,별별별이??????????? 할게 없어서..,ㅠㅠㅠ,False,"안녕하세요 넥플릭스를 쭉~ 함께했던 사람 인데요..
자꾸 튕겨요ㅠㅠ 제 핸드폰의 문제 있는줄 알았더니
다 잘되는데 넥플릭스 앱 만 잘 안돼네요ㅠㅠㅠ
해결해 주세요ㅠㅠㅠ",2021-07-26 12:31:13,5
1288,징정령,진정령.. 왜 없을까요?,False,"다른 플랫폼에 다 있는 진정령.. 왜 넷플에만 없을까요?? 진정령이 넷플 빼고 대부분의 플랫폼에 있는 이유가 몰가요?? 모라고생각하시? 다른 재밌는 컨텐츠 많아서 좋지만 진정령이 업으니 별 하나는 아쉽게도 
진정령 주세요",2021-05-01 16:40:36,4
