,userName,title,isEdited,review,date,rating
2093,시나힐,썸네일 디자인,False,잘 보고있습니다 근데 궁금한게 있는데 썸네일 디자인 누가 하는거죠 ..? 보기싫게 생겼어요 너무 .. ㅠㅠ 원작 포스터를 쓰면 안되는 법이 있는건가요 ?,2020-02-10 19:35:15,3
2094,킼ㅋㅋ킼,애니,False,앱은 유용하게 잘 쓰고 있는데 애니메이션이 좀 더 많아졌으면 좋겠습니다.. 그냥 개인적 바램 ..,2020-01-24 14:02:45,4
2095,am1040,자막크기오류 수정바랍니다.,False,"ios13.3 업데이트이후 자막이 너무 커졌습니다. 자막크기 변경도 안되고 기기(아이패드, 아이폰)설정의 자막크기를 수정해도 넷플릭스에는 먹히지 않네요 오류가 나온지 한참되었는데 이번 업데이트에도 전혀 반영이 안되어있더라구요   빠른 반영바랍니다.",2020-01-22 15:49:52,1
2096,이정도면 사긴데,완전 별로.,False,"넷플릭스 깔지 마세요 진짜 별로임.
얘 때문에 지금 스트레스 만땅. 볼 것도 딱히 없음.
차라리 딴 앱에 돈 주고 보셈.
별로별로 완전 별로 계속 끊기고 화면 검정색 돼서 
목소리만 나옴 1초보고 끊기고 1초보고 끊기고
갑자기 잘 나온다 했더니 화질 다 깨짐. 
참고로 아이폰 X 쓰는중. 다들 넷플릭스 깔지 마세영",2020-01-08 13:56:23,1
2097,벱에,에러가 뜹니다,False,"월정액 결제 후부터 전까지 꾸준히 잘 써오고 있었는데
한 2주전부터 드라마나 예능 보려고 누르면 에러라고 뜨면서 콘텐츠를 재생할 수 없다고 하고 나중에 다시 시도 해달라고 합니다 드라마는 저장 하려고 해도 이렇게 계속 떠서 저장조차 안됩니다 결제는해놓고 에러가 떠서 볼 수 가 없어요",2019-11-21 14:37:03,1
2098,161836281,앱 실행할 때 마다 프로필 설정,False,왜 앱 들어갈때마다 프로필 설정을 다시 해야하는지 이해가 안됩니다 고쳐지지 않았을까 하고 업데이트 바로바로 하는데도 아직도 그러네요 저만 그런건가요??? 대체 왜 영상 보러 들어갈때마다 프로필 설정 뜨는지 모르겠어요 진짜 짜증남 번거롭고.. 앱설정에도 따로 설정 할 수 있는게 없고 왜그러는거죠 넷플릭스 망해라,2019-09-27 23:22:24,1
2099,🌘🌗🌖🌕,무료이용하시려는 분 보세요,False,"무료이용을 한번이라도 사용해봤던 사람이 새로 등록한 사람의 계정을 이용하면 이용이 시스템적으로
중지된답니다. 가입할 때 미리 창을 띄워 준 것도 아닌데 무료이용을 그렇게 한순간에 날리게 한다는 시스템이 최악이네요 문의해보니 그걸 다시 돌려줄 방법도 없답니다 새로 등록한 사람은 이용해보지도 못하고 뭔 죄입니까 등록할 때 안내팝업을 띄워주든 수동적으로 권한을 되찾을 수 있게하든 이것에 대한 대책이 필요해보입니다.",2019-08-16 05:36:46,1
2100,빨간만두,Volume,False,"볼륨이 너무 작습니다.

넷플릭스 시청 중에 통화를 하게 되거나, 팟캐스트, 유튜브를 청취하게 되면 큰 소리에 깜짝 놀라곤 합니다.
개선되면 좋겠습니다.",2019-02-07 02:10:33,3
2101,24장,화질문제,False,프리미엄 요금제로 아이패드(12.9)이용해서 보고 있는 유저인데 화질이 계속 안좋네요....,2019-07-12 05:12:19,4
2102,ㅇ브나자바자바,업뎃후 자막 가독성 개구려요 ㅜㅜㅜㅜ,False,"업뎃후 자막이 유튜브 공짜로 달리는 자막처럼 회색 투명도 65 네모에 들어가있어서 구려요
전처럼 영화보는 자막느낌도 안나고 글씨 크기도 좀 커지고 네모때문에 자막이 영상 방해하는것 같아요...
이런거써봐야 한국 넷플이라 소용없나요?ㅜ
자막 너무 구려서 결제 취소하고싶을정도에요ㅠㅠㅠㅠㅠㅠㅠㅠㅠㅠ",2019-07-10 15:48:12,1
2103,ㅑㅓㅓㅓㅏ,이어보기 시 오류,False,이어보기로 영상을 보면 제 휴대폰 기종만 그런지는 모르겠는데 화면이 더 작게 재생됩니다. 개선 부탁드립니다.,2019-05-26 09:36:20,4
2104,니냐니냐나나나뇨,안 보는 영상 삭제 기능 필요함,False,한 번 보고 재미없어서 지우고 싶은데 시리즈 끝까지 다 봐야 삭제 되는거 너무너무너무 불편함. 계속 시청중인 리스트에 떠서 지워버리고 싶음 !!!!,2018-08-06 13:38:11,3
2105,jyjy5353,구간이동 설정,False,지금 구간이동설정이 10초인데 10초는 너무 길어요ㅠㅠ 구간이동 2초로도 만들어주세요ㅠ 아니면 자막 단위로 앞뒤로 넘길 수 있거나ㅠㅠㅠㅠㅠ제발요ㅠㅠ,2019-01-19 02:08:10,5
2106,데론즈2t,와...,False,"진짜 아는사람만쓰는 이런 신세계
근데 최신영화를 좀만더 빨리업로드 하면좋을듯",2019-01-13 05:26:19,5
2107,정품앱,빨리 감기 기능이 추가 되었으면 좋겠어요,False,1.2배 나1.5배 더 빠르면 2배속으로 컨텐츠를 짧은 시간 많이 보고 싶어요,2018-12-27 10:48:57,4
2108,뚜구둑 으다운 ㄷ,"에피소드 업데이트 느림, 최근엔 버퍼링 발생시작",False,"에피소드 업데이트가 느린건 항상 불만이었지만 그러려니 했습니다
그런데 최근엔 스트리밍 중에 버퍼링으로 인해서 볼 엄두가 안나네요. 이건 진짜 컨텐츠 서비스업으로서 치명적 단점 아닌가요. 넷플릭스 항상 만족하면서 애용해왔는데 실망이 큽니다.",2018-12-25 10:55:27,1
2109,대퐁스,10초 앞으로 가기 왜 안 만들어줍니까,False,넷플릭스 영상이 무슨 성경이라도 됩니까 1초도 넘기지 말고 충실하게 다 봐야하나봐요?,2018-11-10 07:29:58,4
2110,wejjfochannnd,어마어마한 넷플릭스 고객센터,False,자신들 쪽에 에러문제가 발생했으나 양해하라고~전체기기 로그아웃해보겠으나 언제될지 모르니 24시간 기다려보고 안되면 다시 연락하란다. 연락주는 시스템은 없고 위의 책임자도 연결이 안되는 시스템이란다. 고객을 연결할 수 있는 어떤 시스템도 없단다. 말을 똑똑 끊어가며 안된단다. 세상 신기한 넷플릭스 고객센터!! 회사연락처도 막혀있다. 담당자 분 이거 보시려나?,2018-09-26 01:15:38,1
2111,카톡채널 제거,콘텐츠 부족. 앱 로딩 실패.,False,"이 두가지가 요즘 해지하고 싶게 만듭니다..
웬 이상한 것들만 올라오고.
앱 로딩 실패는 왜 그런건지 모르겠으나 자꾸 껐다 켜야해서 불편합니다.",2017-10-16 10:54:00,3
2112,잼니곧듀,멤버십 결제수단에 휴대폰결제 좀 넣어주삼,False,오징어게임으로 돈도 많이 벌었으면서 결제수단은 아직도 구시대적이네;;; 요즘 휴대폰결제 안 되는 플랫폼이 어디있다고;,2021-12-15 11:21:56,3
2113,유욤댕,넷플릭스에 체인지 데이즈가 안떠요 갑자기,False,몇일 전까지만해도 검색해도 나왔는데 갑자기 검색해도 안나와요 왜 그런거죠??,2022-07-07 17:26:59,4
2114,eineee,너무 즐겁게 보던,False,식극의 소마 시리즈가 1 4기 빼고 다 사라졌네요 제발 사라진 만화 시리즈 되돌려 주세요,2022-04-09 12:04:20,4
2115,풀밍밍,너무 자주 끊겨요,False,"잘 보고 있다가 너무 자주 끊깁니다.
그리고 드라마 밑에 제작자들 이름 나올 때
자막을 위에 올리니까 선전성 등 위해도 평가나 카톡에 가려서 자막이 안 보여요",2021-12-08 10:00:37,3
2116,네??????,애니가 다 사라졌어요,False,뭐죠 잠시만요 저 뇌정지 씨게 왔는데 넷플릭스 왜 애니 다 사라졌나요.. 제 폰만 그런거라면 다행이지만 주변 지인들도 사라졌고..,2021-12-07 14:06:58,4
2117,jjjjiiiieeeee,갑자기 영상이 안 나와요,False,"며칠 전부터 갑자기 영상이 끝까지 안 나오고 끝나기 2-3분 전쯤부터 블랙화면만 나오고 자막도 안 나오고 소리만 나요 어플을 껐다 켜도 그렇고, 특정 콘텐츠가 아니라 모든 영상 콘텐츠에서 동일한 현상이 나타납니다",2021-09-19 03:38:08,2
2118,쟁영잉,드래곤 길들이기 시리즈,False,드래곤 길들이기3좀 넣어주세요 제발요••• 시리즈별로 다 있으면서 왜 이건 없냐고요,2021-10-11 05:29:14,5
2119,물론 난 60씀,다 좋은데,False,정말 볼것도 많고 정말 좋은데 저희는 해리포터도 없고 코난도 없고 진짜 눈물만 광광흘리고 있습니다..,2021-05-18 16:51:10,5
2120,세민🥜,내가 시청중인 콘텐츠 다 사라짐,False,"제가 보던 작품이 한 여섯개있었는데 좋알람빼고 다 없어졌어요 그래서 다시보고 꺼봤는데 그래도 안뜸,,다른작품도 보다 말아봤는데 안뜸’ㅜㅠㅠ",2020-10-05 15:34:00,3
2121,무료 충전도 힘들어요ㅠ,해리포터ㅓㅡㅡ,False,해리포터가 없는게 진짜 너무 아쉽습니다. 근데 아이패드로 보니까 좀더 재밌더라고요?ㅋㅋㅋㅋㅋㅋ 왠진 모르겟서요,2020-12-13 02:17:55,4
2122,뿨큐,메이즈러너 데스 큐어,False,"아니ㅜㅜㅜ 관계자분들 제발 메이즈러너 대스큐어 내주세요 제발요ㅠㅠㅠㅠㅠㅜㅜㅜㅜㅜ
Plz launch the ‘Maze Runner:The Death Cure’ I really mean it :( :(",2020-11-07 03:48:51,5
2123,"-"":&;;₩₩,&2'바ㅐ앨초ㅜ나매",아니 진짜,False,다른건 자 좋은데 제가 친구 계정을 쓰고 있는데 계속 비번이 틀렸다고 안 들어가지가든요..;; 그래서 친구다 비번을 4번이나 바꿨는데 저만 계속 안 들어가져요 2주전부터 계속 그랬습니다..;;,2020-10-15 10:27:47,2
2124,지니어스 랩,왜 이러는지 모르겠음,False,"중간중간 갑자기 자막 안 나오고
아이패드나 웹은 잘 되는데 아이폰에서 앱 실행할 때 계속 프로필 잠금 비밀번호 입력하라고 뜨는데 내 프로필 선택 안 돼서 비밀번호 몰라서 못 들어감 
대체 어느 프로필 비밀번호 입력해야되는지도 안 떠서 모름",2020-10-14 12:57:13,1
2125,다귀찮....,볼게별로없..,False,딱히 안유명한걸 보려는것도 아닌데... 왓챠랑 왔다갔다하며 구독하지않게해주세요.. 저도 귀찮....,2020-10-03 14:25:40,3
2126,브라운슈가밀크티,"ios 자막크기,,",False,너무너무 불편해요 크기제어가 앱에서 안되는거야 당연하고 아이패드 자체 설정도 안먹히고 빠른 피드백 바랍니다,2020-01-06 00:14:36,3
2127,별과나무,multisubs 기능 추가부탁드립니다,False,다른 경쟁사는 동시에 영어/한국어 자막을 뜨게 할 수 있어 영어공부할 때 많은 도움이 되는데 넷플릭스는 크롬확장 프로그램 없이는 볼수없어 불편하네요. 자체 어플에 multisubs 기능 추가되었음 합니다.,2020-09-30 11:48:19,1
2128,04.장미칼,뭐야 스파이더맨 뉴 유니버스 돌려줘요,False,돌려주세요 진짜 제발 사랑하는 넷플릭스님 왓챠에도 없던 건데 진짜 사랑해요 돌려주세요ㅠㅠㅠㅠㅠ,2020-08-23 08:11:04,5
2129,빅히트 한두번도 아니고 해명해,빨리감기가 필요해요..,False,제가 성격이 조금 급햐서 답답할때 뛰어넘기를 하는데 렉이 너무 많이 걸려요;; 빨리감기기능좀 만들어주세요..,2020-08-22 08:23:06,4
2130,Jh1402,거지같네,False,"아니 무슨 가입도 앱에서 안되고 가입도 복잡하고 연동도 잘 안되고
꾸역꾸역해서 보려고 했더니 진짜 다른 리뷰라신 분들처럼 자막이 반을 가리고 얼굴을 가려버리니 원 보고 싶지가 않네 자막 뒤에 불투명한 검은 건 왜 넣은거야 그럼 자막크기를 대폭 줄이던가 아니 볼맛 진짜 사라지네
옆동네는 이정도는 아닌데 진짜 개구리다 거지같네 진짜 첫 리뷰가 이런걸줄은 거지같네 진짜",2020-08-17 13:51:42,1
2131,내가구렁이다,잘 쓰고있어요,False,처음 써보는데....화면 터치로 화면 밝기나 소리 조정이 가능했으면 좋겠어요 ㅎㅎ,2020-04-14 14:23:23,5
2132,갈랄달락,넷플릭스 주주입니다. 한마디합니다,False,"자막크기 조절 해주세요

한영동시자막 지원 해주세요. 미드로 영어공부하는사람 많아요

재생속도조절기능. AㅡB 구간반복기능 해주세요

추천영상말고 작품 목록을 장르별 모든 리스트로 조회 가능하게 해 주세요.",2020-02-22 00:58:37,1
2133,Hanharm,다 맘에 드는데 갑자기 티비에 연결하는 아이콘이 사라졌어요,False,다 좋은데 갑자기 티비에 연결하눈 아이콘이 사라져서 연결을 못 하고 있어요ㅠㅠ,2020-01-16 11:55:57,5
2134,choiminjeung,ios 13.3.3 업뎃 후 자막 크기,False,"소프트웨어 업데이트 후 자막 크기가 너무 커져서 불편합니다. 아이폰 설정에 자막 크기 변경으로도 변경이 안되고 있어요. +영상 초반 화면 상단에 상영 등급, 폭력성 등 뜰때 자막 위치 조정이 자동으로 안돼서 자막이 안보이는 현상 + 자막이 화면 상단에 뜰때마다 줄같은게 보여요. 업데이트 언제 하시나요",2020-01-10 01:20:41,1
2135,wltn0407,미미일소흔경성 자막이 너무 이상해요,False,미미일소흔경성 중드 좋아해서 뵜는데 자막이 너무 이상해요.  출연자 이름도 제대로 해석 안되어있고 보기 불편합니다ㅠ 좋아하는 영화나 드라마 많이 있어서 일단은 다른거 보려구요.,2019-02-13 15:37:43,3
2136,나쁜녀석들,최근 패치로 아이패드 자막 크기 비정상적으로 커졌습니다.,False,"빨리 고쳐요. 아이패드로 이용못하고있잖아요.
아니 이걸 3주째 방치하고있나요?? 몇주째 모바일로 사용 못하고있잖아요. 영자막은 정상크기던데 한글만 이러는거보니 본사에서 피드백 처리가 늦어지는건가요? 진짜 개답답합니다. 한국이 호구인가요?",2019-12-30 18:02:48,1
2137,귤맛꿀,개선점,False,"한영 자막 동시 지원
카테고리 종류 좀 여럿으로 늘려 주세요
시청 목록 지울 수 있게 (다 봤던 거 뜬금없이 시청 목록에 뜨고 더 이상 시청하고 싶지 않을 때 지울 수 있게)
찜한 콘텐츠 파일 목록을 만들 수 있게 하면 좋겠습니다",2019-10-12 22:42:43,2
2138,고양이귀냠냠,브나나 다음시즌 제발제발..,False,시즌4 마지막화 개빡치는거 알아서 다음시즌 나오면 보려고 묵혀뒀는데 이러다가 화석된다고요 제발 빨리,2019-07-14 17:59:05,5
2139,별명겹치면어떡해,로그인,False,"대체 왜 로그인이 안되나요..? 
네이버로 들어가서는 로그인이 되는데 어플에선 안돼요
근데 영상은 앱에서만 볼 수 있는데 그 앱에서 로그인이 안된다구요...ios가 최신이면 그렇다는데 넷플릭스보려고 ios를 다운그레이드 할 수는 없잖아요? 가능하지도 않구요
최신 ios에서 로그인부터 안되는 오류 꽤 오래 전부터 있었던 것 같은데 아직도 해결 안되나요..???",2019-06-24 10:49:04,1
2140,😿😾💅🏻,이중자막기능이 추가되면 좋겠습니당!!!,False,넷플릭스에서만 볼 수 있는 좋은 작품들이 많은데 이중자막으로 보고싶은데 안되네요ㅠㅜ 너무 아쉬워요😔 꼭 추가됐으면 좋겠네요,2018-02-24 02:51:29,3
2141,황우유,동영상 멈춤 개선해주세요,False,"요즘 영상이 너무 멈춰서 계속 어플 나갔다가 
다시 실행해야한네요....",2018-12-23 10:49:01,5
2142,줴이디,자동결제 취소부탁드려요,False,"오늘이 무료이용 종료일이라 이용해지하려했는데 먼저 결제가 되었어요
결체취소 해주세요",2018-08-10 10:53:20,5
2143,짬뽕짜장,애니쪽도 업뎃해주세요,False,"언제적 나온건데 1기밖에없는것도있고
1,2기없이 3기만 있기도하고 기대하고 보려했는데
넷플릭스 드라마외엔 애니쪽은 막상 많이없네요ㅠㅠ",2017-12-14 05:22:48,3
2144,오욘디,오류 고쳐주세요,False,현재 체험기간 한달이 지나지않았고 결제수단 업그레이드를 하라고 요구하며 꺼지는데 카드번호를 입력해도 안되네요 빨리 고쳐주세요,2017-11-12 14:04:06,3
2145,K_SHON,앱에서 화질 설정 못하는것 좀 고쳐주세요,False,거의 모바일로만 보는데 프리미엄돈내고 왜 이런 화질로밖에 볼 수 없는건지…,2021-12-13 11:44:29,3
2146,노먼베이츠,넷플릭스 해지예정,False,"1. 자막에 블랙박스 생기고 거슬리고 짜증나서 못보겠음
2. 10초 뒤로가기는 있는데 앞으로 가기가 없어서 불편함
2는 참고 봤는데 1때문에 더는 안보겠음
영화 컨텐츠는 매우 부족해도 재밌는 미드들이 많아서 유료회원 유지 했는데 앱이 엉망이라 해지",2017-10-29 08:34:56,1
2147,카메라v,모자이크 처리좀,False,저기요 애니메이션 모자이크 하실거면 올리지 마세요. 모리감 확 떨어져요 방송 규제인거 알 겠는데요 짜증나서 돈이 아깝네요 모자이크 없애주세요,2021-12-27 12:48:41,4
2148,사람1637391062,내가 찜한 콘텐츠 메뉴 접속 불가,False,"찜 리스트에 내역이 많은데, 무슨 기능 홍보 팝업만 뜨고 닫으면 닫아지는데 찜한 콘텐츠 메뉴도 나가져요. 이렇게 찜한 콘텐츠 메뉴에 접속이 안돼요. 여러번 시도해봤습니다. 기능상 오류같은데, 찜한 콘텐츠 내역 그대로 보존되는건 맞나요? 빠른 해결부탁드립니다.",2021-12-15 00:12:35,1
2149,아티스트y,목록별 관련영화 잘좀나노게 해주세요,False,"이어보기 목록도 만들어 제가 보던 영화도 잘찾게 되었으면합니다
너무 난잡해요 깔끔하게 만들어주세요 ㅜ",2020-12-23 03:37:15,3
2150,굴다리황태자,가끔,False,"가끔 화질이 계속 떨어져요
와이파이이거나, 5G 이용시인데도 그래요.
닫았다가 다시 재생하면 원래 고화질로 돌아가는데, 몇분 지나면 다시 화질이 떨어져요",2021-11-09 03:51:18,4
2151,ㅎ혬2,"오류 수정좀,,",False,"아이패드로 보다가 멈추고 다시보면 다른회차 다른화면 재생되고, 가끔 10초 빠르게 누르면 보고있는 회차 젤 끝으로 가버리고.. 핸드폰,노트북은 안그러는데 아이패드만 그러네요",2021-10-28 15:18:40,2
2152,jong56,다 좋은데 오류가 있습니다,False,특정드라마를 보는데 끝나기 항상 1:30초정도 전 쯤에 화면이 멈추면서 소리만 나와요 그래서 기분좋게 마무리 할려고 하는데 화면이 멈추니깐 스토리도 못보고 이해하기 힘들어지네요,2021-09-19 03:31:34,1
2153,언능봐,1시즌 모무다운받는기능,False,"3년째 잘쓰고있습니다
1화 2화 따로 다운하는거 말고 전부 다운받는 기능이있으면 좋을듯합니다",2021-04-13 16:01:01,4
2154,믿고 했던 심즈가 재미가없다,화질 개선 해주세요,False,아이폰 11 쓰고있는데 고화질 설정이랑 데이터 최대 사용 설정까지 했는데 해상도가 무슨 모자이크 해논 마냥 360p도 안되는듯해요,2020-09-19 16:15:15,3
2155,리뷰트리,다음화 누르고,False,"오프닝 건너띄기 탭하면 계속 처음 오프닝 화면으로 돌아가고 재생바 컨트롤 먹통이고 계속 오프닝 첫장면으로 돌아감 재생화면 종료하고 회차화면에서 다시 들어가야하나 다시 반복되는 에러로 매우 짜증남
아이패드 미니 사용하며 이번 달까지 수정안되면 구독종료합니다",2020-11-21 12:26:45,1
2156,바꿔주세요세요,(이중자막 요청) 너무 좋아하는 앱이지만,False,"너무 좋아하는 앱이지만
왜 모바일로는 이중자막이 안되나요 ㅠㅠ

영어공부하려고 넷플릭스 다운 받는 사람도 엄청 많은데 이중자막기능 요청합니다 ㅠㅠ",2019-12-22 11:59:18,3
2157,sksbs,결제 환불 요청합니다,False,"오늘 무료체험기간 끝나고 결제가 된듯해요 
환불 하려면 어떻게 해야하죠?",2020-04-17 03:26:06,5
2158,아닐로그 사랑,진짜 너무 좋아요~,False,근데 제발 팅커벨 좀 추가 해주세요..디즈니 쪽을 너무 좋아하는데 진짜 팅커벨 좀 추가해주세요 ㅠㅠ,2020-03-17 12:17:46,5
2159,아에이우어어어ㅓ어야ㅑ어어ㅓㅇㅇ,자막크기,False,다 좋은데 업데이트 하고 나서 자막 크기가. 커져서 다시 줄어들지를 않아요. 제발 이거좀 해결해주세요ㅜㅜㅜㅜㅜㅜㅜㅜㅜㅜ,2020-01-05 14:55:28,5
2160,혀니성현이혀니,고객센터 문의,False,드러마 시즌이 끝난지도 몇개월인데 아직 넷플릭스만 안올라오길래 문의할라고 고객센터 들어갔더니 올리는 게시판 같은게 없어서 불편하네요,2019-11-13 00:33:13,3
2161,뿌앵우앵뿡빵빵,아이패드 자막 크기,False,방금 업데이트 했는데 자막이 갑자기 너무 커졌어요... 설정에서 변경해도 그대로에요 빨리 고쳐주세요 ㅠㅠㅠㅠㅠㅠㅠㅠ,2019-12-13 10:58:21,4
2162,suwoncity_,"일본해(X), 동해(O) 표기 정정 요구",False,넷플릭스 시리즈 중 하나인 '10대 사건으로 보는 제2차 세계대전' 에피소드 중 시즌1의 3화에 사용되는 지도에 동해(East Sea)가 일본해(Sea of Japan)로 표기되어 있습니다. 이는 명백한 오류이며 표기를 정정할 것을 요구합니다.,2019-11-27 14:40:01,1
2163,박박수수학학원원장,배속문제,False,배속 기능 언제 만들어주실건가요ㅠ 그리고 한국콘텐츠가 몇개 없어서 참 슬프네요 일단 우선 배속기능부터ㅜㅜ 저는 성질머리가 아주급한사람이라 영화드라마보면서 안달나 미칠거같아요,2019-11-21 11:40:36,2
2164,으머아러,글씨 크기 좀 줄이고 한 영 자막 동시에 띄우는 기능 만들어주세요,False,"다 좋은데 이 기능 부탁드립니다
제발 한 영 자막 동시에 띄우는 거 만들어 주세요 ㅠㅠㅠㅠㅠㅠㅠㅠㅠㅠㅠ",2019-11-21 10:01:00,5
2165,ㅃㅉ강,환불요청합니다,False,30일무료후에 잘못눌러서 결제가 된거같은데 계정을 지우지않고 앱만 삭제해서 돈이 계속 나가는거 같아요 환불 요청합니다,2019-07-25 12:21:33,3
2166,ㅇㄹㄹㅣ호ㅗㅗ,콘텐츠 저장 기능,False,콘텐츠 저장 기능 사용하는데 원래 이렇게 느린가요? 지금 아이폰xs사용중인데 기기 문제는 아닌거 같고 원래 다운로드가 이렇게 느릴게 아닌거 같은데... 거의 하나 받는데 한시간 가까이 걸리네요,2019-06-30 14:41:21,3
2167,긍긍전,부탁드릴게요!!,False,"생각보다 좋아서 자주 봤습니다
볼 수 있는 한국드라마 종류가 더 많아지면 좋겠습니다
아이폰이라서 구매내역 지워주세요~!!",2019-02-22 02:12:42,3
2168,올리버양인데 왜 버섯을 달래,재생도 다운도 안 되면 어쩌라는 건가요,False,굿플레이스 업데이트도 느려터진 거 기다려서 보려고 했더니 이젠 오류가 나서 못 보고 있음 오류5009라는데 어플 업데이트도 해봤는데 안 됨,2019-02-04 14:08:28,3
2169,루디엉,넷플릭스 오류,False,넷플릭스 오리지널 콘텐츠를 제외하고 다른 콘텐츠들이 전부 없어졌어요 vpn도 사용한적 없는데 왜이러나요 ㅠㅠ 검색해도 오리지널만 나오고 찜해둔 것들도 오리지널 말고는 안보여요ㅠㅠㅠㅠ,2022-02-23 12:11:26,3
2170,아왜별명이다안돼,보완점 3가지,False,"1. 앞,뒤 모두 스킵 가능하게 하기
2. 자막을 최대 두개까지 띄울수 있게 하기(위아래로)
3. 찜한목록 업데이트가 안됩니다.(늦게라도 업데이트 되는게 아니라 안됩니다 ㅋㅋ) 찜했다가 풀거나, 새로운거 찜하거나 이럴때 업데이트가 안됩니다. 로그아웃했다가 다시로그인해야 업데이트가 돼요ㅋㅋㅋ 개인적으로 이게 젤 불편해요 보완해주세요 제발.",2019-01-31 09:37:46,1
2171,900219ing,빡침,False,아니 한국 드라마나 예능은 티비 켜면 나오는 건데 넷플에 너무 많고 정작 영미권 드라마나 영화 같은 건 없고 그렇다고 우회도 안 되고 자막 번역 안해도 좋으니까 일단 좀 해외 기본 드라마 같은 건 좀 넣어주세요 ㅠㅠ 넷플 기대해서 먼저 결제했는데 추가되는 것도 없고 결국 왓챠랑 둘다 쓰는 중인데 왓챠에 해외드라마가 더 많은 듯 돈아까움요 해외드라마 보실분은 왓챠 ㄱ,2018-12-15 22:48:54,1
2172,ㅑㅗ쳐쵸,진짜화나네요,False,이런리뷰 작성잘안하는데 화가나서 씁니다 계속 로그인해도 튕기고 하기전에도튕기고 보고있는데도 튕기고 보지말라는거예요? 노트북이 이상한가 싶어서 딴친구들 노트북도 다 안돼요 다 수리하고 같이 손잡고 가야 하나요? 계속 튕겨서 못 본지도 오래됐어요 안본게 아니고요 내가 낭비한시간은 어떻게 보상해주실꺼죠?,2018-09-15 03:40:50,1
2173,케이(Kay),왜이리 미국이랑 다르게 서비스합니까...?,False,"프리미엄으로 돈주고 보고있는데 루시퍼 시즌3 나왔는데도 시즌2밖에 안올려주고
요청을 그리해도 개선도 안해주고 반영도 1도없고
답변도 안해주고.....
서비스 답답하네요 다른 서비스로 갈아탈까봐...",2018-08-15 11:20:33,2
2174,송알송알싸리잎에옥구슬,로그인이 안돼요,False,"자꾸 맞지 않는 아이디 혹은 비밀번호라고 뜨네요
혹시나 해서 노트북으로 비밀번호를 바꿔봐도 모바일에선 로그인이 안돼요",2018-05-30 03:55:42,4
